{
  "schemaVersion": 1,
  "id": "hosted-storage-common-workload-v1",
  "semanticOracle": "mdbase-rs canonical evaluation at the benchmark revision",
  "timezone": "Australia/Melbourne",
  "projectionFormat": "hosted-benchmark-projection-v1",
  "malformedRecordPolicy": "Preserve exact Markdown as opaque, retain path-inferred types, expose empty persisted/effective frontmatter plus a bounded parse diagnostic, include the record in type-only candidates, and require exact fail-closed classification for authorization.",
  "expectedResultArtifact": "fixtures/<tier>/expected-results.json",
  "resultAssertion": "exact ordered stable record IDs, page boundaries, response-field digest, total/matched/returned counts, group keys/counts/summaries, diagnostics, and typed outcome",
  "queryWorkloads": [
    {
      "id": "tasknotes.selective_open_project",
      "sources": ["tasknotes/src/api/runtime-api.ts:914", "mdbase-tasknotes/src/commands/list.ts:14"],
      "candidateIr": { "all": [{ "typeIn": ["task"] }, { "fieldEq": ["effective_frontmatter.status", "open"] }, { "fieldContains": ["effective_frontmatter.projects", "project-7"] }] },
      "selectivity": "generated exact; target below 1%",
      "responseFields": ["path", "types", "effective_frontmatter"],
      "order": [{ "field": "effective_frontmatter.due", "direction": "asc", "nulls": "last" }, { "field": "path", "direction": "asc" }],
      "page": { "limit": 200, "offset": 0 },
      "acceptableRunOutcomes": ["success"],
      "acceptableBudgetKinds": [],
      "acceptableErrorCodes": []
    },
    {
      "id": "tasknotes.broad_active_page",
      "sources": ["tasknotes-app/src/storage/mdbase-repository.ts:1003"],
      "candidateIr": { "all": [{ "typeIn": ["task"] }, { "fieldIn": ["effective_frontmatter.status", ["open", "in-progress", "waiting"]] }, { "fieldEq": ["effective_frontmatter.archived", false] }] },
      "adapterNormalization": "Frozen hosted benchmark adapter for TaskNotes local active/completed/archive semantics; not a current single provider predicate.",
      "selectivity": "generated exact; target 45-60% of tasks",
      "responseFields": ["path", "types", "effective_frontmatter", "body"],
      "order": [{ "field": "path", "direction": "asc" }],
      "page": { "limit": 1000, "offset": 0, "repeatToCompletion": true },
      "acceptableRunOutcomes": ["success"],
      "acceptableBudgetKinds": ["result", "scan"],
      "acceptableErrorCodes": []
    },
    {
      "id": "tasknotes.path_title_completion",
      "sources": ["tasknotes-app/src/storage/mdbase-repository.ts:261"],
      "candidateIr": { "any": [{ "fieldContainsText": ["path", "task-000042"] }, { "fieldContainsText": ["file.basename", "task-000042"] }, { "fieldContainsText": ["effective_frontmatter.title", "task 420"] }] },
      "selectivity": "generated exact; target below 0.1%",
      "responseFields": ["path", "types", "effective_frontmatter"],
      "order": [{ "field": "path", "direction": "asc" }],
      "page": { "limit": 48, "offset": 0 },
      "providerOverfetchRule": "max(caller_limit * 4, 48), followed by local completion limit",
      "acceptableRunOutcomes": ["success"],
      "acceptableBudgetKinds": [],
      "acceptableErrorCodes": []
    },
    {
      "id": "tasknotes.tag_due_range",
      "sources": ["mdbase-tasknotes/src/commands/list.ts:14", "tasknotes/src/api/runtime-api.ts:914"],
      "candidateIr": { "all": [{ "typeIn": ["task"] }, { "fieldContains": ["effective_frontmatter.tags", "hosted"] }, { "fieldLt": ["effective_frontmatter.due", "2026-06-01"] }] },
      "selectivity": "generated exact; tag membership plus date range",
      "responseFields": ["path", "types", "effective_frontmatter"],
      "order": [{ "field": "effective_frontmatter.due", "direction": "asc", "nulls": "last" }, { "field": "path", "direction": "asc" }],
      "page": { "limit": 200, "offset": 0 },
      "acceptableRunOutcomes": ["success"],
      "acceptableBudgetKinds": [],
      "acceptableErrorCodes": []
    },
    {
      "id": "tasknotes.group_status_count",
      "sources": ["tasknotes-app/src/storage/mdbase-repository.ts:647", "tasknotes/src/api/TaskNotesAPI.ts:1673"],
      "candidateIr": { "typeIn": ["task"] },
      "selectivity": "all tasks",
      "responseFields": ["groups.key", "groups.count", "meta.total_count"],
      "group": [{ "field": "effective_frontmatter.status" }],
      "summaries": [{ "function": "count", "field": null }],
      "adapterNormalization": "TaskNotes saved-view result: group values, count, and count summary; distinct from runtime API taskPaths groups.",
      "order": [{ "field": "group.key", "direction": "asc" }],
      "page": { "limit": 2000, "offset": 0 },
      "acceptableRunOutcomes": ["success"],
      "acceptableBudgetKinds": [],
      "acceptableErrorCodes": []
    },
    {
      "id": "editor.metadata_index",
      "sources": ["mdbase-editor/src/gateway.ts:150"],
      "candidateIr": { "all": [] },
      "selectivity": "all records",
      "responseFields": ["path", "types", "file", "persisted_frontmatter", "effective_frontmatter"],
      "order": [{ "field": "file.mtime", "direction": "desc" }, { "field": "path", "direction": "asc" }],
      "page": { "firstLimit": 200, "subsequentLimit": 1000, "repeatToCompletion": true },
      "acceptableRunOutcomes": ["success"],
      "acceptableBudgetKinds": ["result"],
      "acceptableErrorCodes": []
    },
    {
      "id": "editor.body_hydration_page",
      "sources": ["mdbase-editor/src/gateway.ts:175"],
      "candidateIr": { "all": [] },
      "selectivity": "all records at the pinned Editor snapshot",
      "responseFields": ["path", "types", "file", "persisted_frontmatter", "effective_frontmatter", "body"],
      "order": [{ "field": "file.mtime", "direction": "desc" }, { "field": "path", "direction": "asc" }],
      "page": { "limit": 1000, "offset": 0 },
      "acceptableRunOutcomes": ["success"],
      "acceptableBudgetKinds": [],
      "acceptableErrorCodes": []
    },
    {
      "id": "reader.source_library_page",
      "sources": ["mdbase-reader/packages/connect/src/source-repository.ts:36"],
      "candidateIr": { "typeIn": ["reader-source"] },
      "wireAdapter": "Reader sends a source contract; mdbase-rs compiles the contract implementation set to this candidate type set.",
      "selectivity": "all reader sources; reading-status filtering remains an explicitly measured client residual",
      "responseFields": ["path", "types", "effective_frontmatter"],
      "order": [],
      "deterministicOracleTieBreaker": "stable record ID only; Reader does not request provider ordering",
      "page": { "firstLimit": 500, "subsequentLimit": 1000, "repeatToCompletion": true },
      "clientResidual": { "fieldEq": ["effective_frontmatter.reading.status", "reading"] },
      "acceptableRunOutcomes": ["success"],
      "acceptableBudgetKinds": ["result"],
      "acceptableErrorCodes": []
    },
    {
      "id": "reader.body_search_common",
      "sources": ["mdbase-reader/packages/connect/src/content-search-repository.ts:20"],
      "candidateIr": { "bodyContains": "common-body-needle" },
      "canonicalResidual": { "typeIn": ["reader-source", "reader-annotation"] },
      "consumerTransform": { "kind": "readerContentMergeBySource" },
      "selectivity": "candidate body predicate matches 20% of all records; canonical residual keeps Reader source/annotation rows and merges their kinds by source",
      "responseFields": ["path", "types", "effective_frontmatter"],
      "derivedJoinInputs": ["effective_frontmatter.id", "effective_frontmatter.source"],
      "order": [],
      "deterministicOracleTieBreaker": "stable source path after Reader merge; consumer does not request provider ordering",
      "page": { "firstLimit": 500, "subsequentLimit": 1000, "repeatToCompletion": true },
      "acceptableRunOutcomes": ["success"],
      "acceptableBudgetKinds": ["scan", "time", "result"],
      "acceptableErrorCodes": []
    },
    {
      "id": "reader.annotation_for_source",
      "sources": ["mdbase-reader/packages/connect/src/annotation-repository.ts:167"],
      "candidateIr": { "typeIn": ["reader-annotation"] },
      "clientResidual": { "relationshipTargetEq": "src_0000042" },
      "selectivity": "generated exact; target 1-10 annotations",
      "responseFields": ["path", "types", "effective_frontmatter"],
      "derivedJoinInputs": ["effective_frontmatter.source"],
      "hydrationFields": ["document", "body", "persisted_frontmatter", "effective_frontmatter", "revision"],
      "order": [],
      "deterministicOracleTieBreaker": "stable record ID only; Reader performs the source join client-side",
      "page": { "limit": 1000, "offset": 0 },
      "hydrationConcurrency": 4,
      "acceptableRunOutcomes": ["success"],
      "acceptableBudgetKinds": [],
      "acceptableErrorCodes": []
    },
    {
      "id": "pickle.pending_inbox",
      "sources": ["pickle/src/collection.rs:196", "pickle-obsidian/src/collectionService.ts:243"],
      "candidateIr": { "typeIn": ["pickle_request", "pickle_response_approval", "pickle_response_ack"] },
      "consumerTransform": { "kind": "picklePendingByResponseMultiplicity" },
      "providerScans": [
        { "id": "requests", "candidateIr": { "typeIn": ["pickle_request"] }, "includeBody": true, "order": [{ "field": "effective_frontmatter.created_at", "direction": "desc" }], "page": { "firstLimit": 200, "subsequentLimit": 200, "repeatToCompletion": true } },
        { "id": "responses", "candidateIr": { "typeIn": ["pickle_response_approval", "pickle_response_ack"] }, "includeBody": false, "order": [], "page": { "firstLimit": 200, "subsequentLimit": 200, "repeatToCompletion": true } }
      ],
      "executionPlan": ["query request implementation types with body", "query response types without body", "join canonical request wikilinks", "cancelled status wins; 0 responses pending, 1 answered, >1 conflict"],